{"authority":{"build_execution":"ATTRIBUTED_NOT_ATTESTED","build_reexecution":"NOT_RUN","compiler_correctness":"UNKNOWN","freshness":"UNKNOWN","general_claim_verdict":"NOT_ASSESSED","hardware_independence":"UNKNOWN","independent_observation":"UNKNOWN","organizational_independence":"UNKNOWN","os_network_sandbox":"NOT_ESTABLISHED","provider_execution_reproduced":"NOT_RUN","signature_integrity":"NOT_ASSESSED","signer_authorization":"NOT_ASSESSED","target_runtime_reproduction":"NOT_RUN","toolchain_closure":"UNKNOWN"},"build_selection":{"binary_sha256":"3989b0b32395b21f1d33468e3af65225e36c22ea28fa7e931807bb8b02a54d10","controller_sha256":"40346dd9adac3c22401cfd9a83a729c164d2951f2baf692bf74b4316f78caff1","left_builder":"builder-a","left_record_digest":"sha256:02249909a7fbd5e5007785b6f4ceb5621b6ad89a34c0f3d4669784e6b9ccad26","right_builder":"builder-b","right_record_digest":"sha256:c050c79699b77eb86afc11c9642d164f4ec364c487dcc1841ab3e1ab6714649a","source_revision":"52a21a8eaa4363d648fdac805900175d81e13f07","source_tree":"ddb6a6b8ee60ee0ac5b865a69a8a60bf0cf06c0e"},"capture":{"binary_sha256":"3989b0b32395b21f1d33468e3af65225e36c22ea28fa7e931807bb8b02a54d10","invocation_id":"6bbab228-541e-4eb1-8e80-a626495e65c8","provider":{"manifest_sha256":"d5d1ec1e80249ba607dcffdd13d8e6baf4413b8277cbce64a71efe59decbfde3","repository":"aixaria0/CHIMERA-OMEGA","revision":"52a21a8eaa4363d648fdac805900175d81e13f07","tree":"ddb6a6b8ee60ee0ac5b865a69a8a60bf0cf06c0e"},"provider_outcome":"CONFIRMED","receipt_digest":"sha256:8832edd572eb04f9cab4f24c082628a66f429dc93ef0945e7cf7025f9ee1861d"},"checker":{"path":"tools/omega-build-evidence.py","repository":"aixaria0/CHIMERA-OMEGA","revision":"9ab2390364fd8c89f29fa46569b58d33ddb61869","sha256":"40346dd9adac3c22401cfd9a83a729c164d2951f2baf692bf74b4316f78caff1","tree":"d80c482dc2a6e20ba4e2cc56217b773772b61610"},"checker_invocation":{"exit_code":0,"stderr_utf8":"","stdout_utf8":"{\n  \"binary_sha256\": \"sha256:3989b0b32395b21f1d33468e3af65225e36c22ea28fa7e931807bb8b02a54d10\",\n  \"dimensions\": {\n    \"build_execution\": \"ATTRIBUTED_NOT_ATTESTED\",\n    \"ci_declarations\": \"NOT_AUTHENTICATED_BY_THIS_VERIFIER\",\n    \"compiler_correctness\": \"UNKNOWN\",\n    \"freshness\": \"UNKNOWN\",\n    \"general_claim\": \"NOT_ASSESSED\",\n    \"hardware_independence\": \"UNKNOWN\",\n    \"historical_capture_binary_binding\": \"NOT_ASSESSED\",\n    \"organizational_independence\": \"UNKNOWN\",\n    \"saved_binary_agreement\": \"CONFIRMED\",\n    \"saved_source_git_object_binding\": \"CONFIRMED\",\n    \"target_execution\": \"NOT_RUN\"\n  },\n  \"records\": [\n    \"sha256:02249909a7fbd5e5007785b6f4ceb5621b6ad89a34c0f3d4669784e6b9ccad26\",\n    \"sha256:c050c79699b77eb86afc11c9642d164f4ec364c487dcc1841ab3e1ab6714649a\"\n  ],\n  \"schema\": \"chimera-omega/source-build-comparison/v1\",\n  \"scope\": \"TWO_ATTRIBUTED_ACQUISITIONS_WITH_TWO_FRESH_BUILDS_EACH\",\n  \"source_revision\": \"52a21a8eaa4363d648fdac805900175d81e13f07\",\n  \"source_tree\": \"ddb6a6b8ee60ee0ac5b865a69a8a60bf0cf06c0e\",\n  \"status\": \"PINNED_SAVED_SOURCE_AND_BINARY_BYTES_MATCH\"\n}\n"},"comparison":{"binary_sha256":"sha256:3989b0b32395b21f1d33468e3af65225e36c22ea28fa7e931807bb8b02a54d10","dimensions":{"build_execution":"ATTRIBUTED_NOT_ATTESTED","ci_declarations":"NOT_AUTHENTICATED_BY_THIS_VERIFIER","compiler_correctness":"UNKNOWN","freshness":"UNKNOWN","general_claim":"NOT_ASSESSED","hardware_independence":"UNKNOWN","historical_capture_binary_binding":"NOT_ASSESSED","organizational_independence":"UNKNOWN","saved_binary_agreement":"CONFIRMED","saved_source_git_object_binding":"CONFIRMED","target_execution":"NOT_RUN"},"records":["sha256:02249909a7fbd5e5007785b6f4ceb5621b6ad89a34c0f3d4669784e6b9ccad26","sha256:c050c79699b77eb86afc11c9642d164f4ec364c487dcc1841ab3e1ab6714649a"],"schema":"chimera-omega/source-build-comparison/v1","scope":"TWO_ATTRIBUTED_ACQUISITIONS_WITH_TWO_FRESH_BUILDS_EACH","source_revision":"52a21a8eaa4363d648fdac805900175d81e13f07","source_tree":"ddb6a6b8ee60ee0ac5b865a69a8a60bf0cf06c0e","status":"PINNED_SAVED_SOURCE_AND_BINARY_BYTES_MATCH"},"link_digest":"sha256:499bad56abc83a7da78928d6557a6429eacfdbc4e60cee634f33d58a8f103419","schema":"chimera-capture-build-link/v1","scope":"CAPTURE_SELECTED_BINARY_AND_SOURCE_TO_PINNED_SAVED_BUILD_EVIDENCE_ONLY","status":"RECORDED_BUILD_EVIDENCE_CHECK"}
